{
  "schema_version": "1.0",
  "id": "full",
  "status": "planned",
  "purpose": "benchmark",
  "description": "Publication-scale dynamic and invariant-control benchmark.",
  "generation_jobs": [],
  "inference_batches": [],
  "resources": {
    "generate_data": {
      "max_parallel_tasks": 4,
      "max_cores": 32,
      "max_ram_gb": 128
    },
    "infer_network": {
      "max_parallel_runs": 4,
      "max_cores": 32,
      "max_ram_gb": 128,
      "planner": "auto",
      "planner_time_limit_seconds": 300
    }
  },
  "planned_design": {
    "simulators": ["dyngen", "scmultisim", "sergio", "boolode", "genespider2"],
    "replicates_per_condition": 5,
    "regimes": ["group_only", "order_aware", "pseudotime_aware", "prior_assisted"],
    "factors": [
      "topology",
      "noise",
      "dropout",
      "group imbalance",
      "small groups",
      "rewiring"
    ],
    "notes": [
      "Invariant-network simulators are negative controls for invented reconfiguration.",
      "Prior-assisted results are reported separately from the primary ranking."
    ]
  },
  "statistics": {
    "status": "planned",
    "alpha": 0.05,
    "random_seed": 1729,
    "permutations": 99999,
    "bootstrap_resamples": 20000,
    "comparisons": []
  }
}
